{
  "registry_id": "logos-training-source-registry",
  "version": "1.0.0",
  "effective_date": "2026-06-26",
  "classification": "INTERNAL — CONSTITUTIONAL",
  "authority": {
    "human_principal_id": "DWS-001",
    "display_name": "David Warren Smith Jr.",
    "short_code": "DJ",
    "signature_mark": "/D.W.Smith/"
  },
  "constitutional_constraint": "No data source enters the Abigail training pipeline without registry presence, clearance posture, provenance, checksum manifest, allowed-use declaration, and Human Principal authority where required.",
  "entries": [
    {
      "source_id": "L1-001",
      "source_name": "Buildspec Volumes I, II, III",
      "source_type": "owned_doctrine",
      "lane": 1,
      "license_family": "LOGOS_OWNED",
      "commercial_use_allowed": true,
      "requires_attribution": false,
      "sharealike_risk": false,
      "no_derivatives_risk": false,
      "pii_risk": "low",
      "copyright_risk": "none",
      "registry_status": "approved",
      "allowed_uses": ["rag", "sft_candidate", "synthetic_seed", "evaluation_reference", "pretraining_candidate"],
      "reg01_status": "approved",
      "lgl01_status": "approved",
      "hp_decision_status": "approved",
      "hp_decision_timestamp": "2026-06-26T00:00:00Z",
      "license_evidence_uri": "LOGOS-owned doctrine corpus",
      "license_checked_at": "2026-06-26",
      "license_checked_by": "LGL-01",
      "component_whitelist": [],
      "drift_risk_level": "low",
      "requires_operator_approval": false,
      "sha256_manifest": "PENDING_SOURCE_MANIFEST",
      "govmem_namespace": "skill-forge/doctrine/buildspec",
      "notes": "Primary owned doctrine corpus."
    },
    {
      "source_id": "L1-002",
      "source_name": "Sprint AARs Signed WORM",
      "source_type": "owned_after_action_reviews",
      "lane": 1,
      "license_family": "LOGOS_OWNED",
      "commercial_use_allowed": true,
      "requires_attribution": false,
      "sharealike_risk": false,
      "no_derivatives_risk": false,
      "pii_risk": "medium",
      "copyright_risk": "none",
      "registry_status": "approved",
      "allowed_uses": ["rag", "sft_candidate", "evaluation_reference"],
      "reg01_status": "approved",
      "lgl01_status": "approved",
      "hp_decision_status": "approved",
      "hp_decision_timestamp": "2026-06-26T00:00:00Z",
      "license_evidence_uri": "LOGOS-owned sprint AAR corpus",
      "license_checked_at": "2026-06-26",
      "license_checked_by": "LGL-01",
      "component_whitelist": [],
      "drift_risk_level": "medium",
      "requires_operator_approval": false,
      "sha256_manifest": "PENDING_SOURCE_MANIFEST",
      "govmem_namespace": "skill-forge/aar/sprints",
      "notes": "Owned AAR material; review for operator-sensitive content before SFT batching."
    },
    {
      "source_id": "L1-003",
      "source_name": "Agent Position Specs JSON IR",
      "source_type": "owned_agent_specs",
      "lane": 1,
      "license_family": "LOGOS_OWNED",
      "commercial_use_allowed": true,
      "requires_attribution": false,
      "sharealike_risk": false,
      "no_derivatives_risk": false,
      "pii_risk": "low",
      "copyright_risk": "none",
      "registry_status": "approved",
      "allowed_uses": ["rag", "sft_candidate", "synthetic_seed", "evaluation_reference"],
      "reg01_status": "approved",
      "lgl01_status": "approved",
      "hp_decision_status": "approved",
      "hp_decision_timestamp": "2026-06-26T00:00:00Z",
      "license_evidence_uri": "LOGOS-owned agent specification corpus",
      "license_checked_at": "2026-06-26",
      "license_checked_by": "LGL-01",
      "component_whitelist": [],
      "drift_risk_level": "low",
      "requires_operator_approval": false,
      "sha256_manifest": "PENDING_SOURCE_MANIFEST",
      "govmem_namespace": "skill-forge/agents/specs",
      "notes": "Primary agent routing and role-definition source."
    },
    {
      "source_id": "L1-004",
      "source_name": "Sentinel Red Team Results and AARs",
      "source_type": "owned_redteam_results",
      "lane": 1,
      "license_family": "LOGOS_OWNED",
      "commercial_use_allowed": true,
      "requires_attribution": false,
      "sharealike_risk": false,
      "no_derivatives_risk": false,
      "pii_risk": "medium",
      "copyright_risk": "none",
      "registry_status": "approved",
      "allowed_uses": ["rag", "evaluation_reference"],
      "reg01_status": "approved",
      "lgl01_status": "approved",
      "hp_decision_status": "approved",
      "hp_decision_timestamp": "2026-06-26T00:00:00Z",
      "license_evidence_uri": "LOGOS-owned Sentinel red-team corpus",
      "license_checked_at": "2026-06-26",
      "license_checked_by": "LGL-01",
      "component_whitelist": [],
      "drift_risk_level": "high",
      "requires_operator_approval": true,
      "sha256_manifest": "PENDING_SOURCE_MANIFEST",
      "govmem_namespace": "skill-forge/eval/sentinel-redteam",
      "notes": "Owned but sensitive. Default to RAG/evaluation reference only. SFT requires separate case-by-case HP approval."
    },
    {
      "source_id": "L1-005",
      "source_name": "HAAP Constitutional Bounds",
      "source_type": "owned_constitutional_bounds",
      "lane": 1,
      "license_family": "LOGOS_OWNED",
      "commercial_use_allowed": true,
      "requires_attribution": false,
      "sharealike_risk": false,
      "no_derivatives_risk": false,
      "pii_risk": "low",
      "copyright_risk": "none",
      "registry_status": "approved",
      "allowed_uses": ["rag", "sft_candidate", "synthetic_seed", "evaluation_reference"],
      "reg01_status": "approved",
      "lgl01_status": "approved",
      "hp_decision_status": "approved",
      "hp_decision_timestamp": "2026-06-26T00:00:00Z",
      "license_evidence_uri": "LOGOS-owned HAAP constitutional corpus",
      "license_checked_at": "2026-06-26",
      "license_checked_by": "LGL-01",
      "component_whitelist": [],
      "drift_risk_level": "medium",
      "requires_operator_approval": false,
      "sha256_manifest": "PENDING_SOURCE_MANIFEST",
      "govmem_namespace": "skill-forge/doctrine/haap",
      "notes": "Use for constitutional behavior, not exposure of private thresholds."
    },
    {
      "source_id": "L1-006",
      "source_name": "Volume III Amendment Layer",
      "source_type": "owned_amendment_layer",
      "lane": 1,
      "license_family": "LOGOS_OWNED",
      "commercial_use_allowed": true,
      "requires_attribution": false,
      "sharealike_risk": false,
      "no_derivatives_risk": false,
      "pii_risk": "low",
      "copyright_risk": "none",
      "registry_status": "approved",
      "allowed_uses": ["rag", "sft_candidate", "synthetic_seed", "evaluation_reference", "pretraining_candidate"],
      "reg01_status": "approved",
      "lgl01_status": "approved",
      "hp_decision_status": "approved",
      "hp_decision_timestamp": "2026-06-26T00:00:00Z",
      "license_evidence_uri": "LOGOS-owned doctrine amendment corpus",
      "license_checked_at": "2026-06-26",
      "license_checked_by": "LGL-01",
      "component_whitelist": [],
      "drift_risk_level": "low",
      "requires_operator_approval": false,
      "sha256_manifest": "PENDING_SOURCE_MANIFEST",
      "govmem_namespace": "skill-forge/doctrine/amendments",
      "notes": "Owned amendment doctrine."
    },
    {
      "source_id": "L1-007",
      "source_name": "Synthetic Instruction Data",
      "source_type": "synthetic_instruction_data",
      "lane": 1,
      "license_family": "LOGOS_OWNED_SYNTHETIC",
      "commercial_use_allowed": true,
      "requires_attribution": false,
      "sharealike_risk": false,
      "no_derivatives_risk": false,
      "pii_risk": "low",
      "copyright_risk": "none",
      "registry_status": "approved",
      "allowed_uses": ["sft_candidate", "evaluation_reference"],
      "reg01_status": "approved",
      "lgl01_status": "approved",
      "hp_decision_status": "approved",
      "hp_decision_timestamp": "2026-06-26T00:00:00Z",
      "license_evidence_uri": "Generated from LOGOS-owned doctrine only",
      "license_checked_at": "2026-06-26",
      "license_checked_by": "LGL-01",
      "component_whitelist": ["L1-001", "L1-003", "L1-005", "L1-006"],
      "drift_risk_level": "medium",
      "requires_operator_approval": false,
      "sha256_manifest": "PENDING_SOURCE_MANIFEST",
      "govmem_namespace": "skill-forge/synthetic/instruction",
      "synthetic_origin": true,
      "prompt_hash": null,
      "generation_agent_id": null,
      "notes": "Synthetic batches must label synthetic_origin=true and store prompt_hash plus generation_agent_id."
    },
    {
      "source_id": "L2-001",
      "source_name": "NIST AI RMF Public Documents",
      "source_type": "public_government_risk_framework",
      "lane": 2,
      "license_family": "PUBLIC_GOVERNMENT",
      "commercial_use_allowed": true,
      "requires_attribution": true,
      "sharealike_risk": false,
      "no_derivatives_risk": false,
      "pii_risk": "low",
      "copyright_risk": "low",
      "registry_status": "reg01_pending",
      "allowed_uses": ["rag", "evaluation_reference"],
      "reg01_status": "pending",
      "lgl01_status": "pending",
      "hp_decision_status": "pending",
      "hp_decision_timestamp": null,
      "license_evidence_uri": "PENDING_LGL01_REVIEW",
      "license_checked_at": null,
      "license_checked_by": null,
      "component_whitelist": [],
      "drift_risk_level": "low",
      "requires_operator_approval": true,
      "sha256_manifest": "PENDING_SOURCE_MANIFEST",
      "govmem_namespace": "skill-forge/external/nist-ai-rmf",
      "notes": "Candidate source only until REG-01/LGL-01/HP clearance completes."
    },
    {
      "source_id": "L2-002",
      "source_name": "Public Domain Governance Texts",
      "source_type": "public_domain_governance",
      "lane": 2,
      "license_family": "PUBLIC_DOMAIN",
      "commercial_use_allowed": true,